,Title,Published_date,Views,Likes,Comments,Month,ID
0,How Different Species of Fireflies Blink - Smarter Every Day 274,2022-06-20T14:00:05Z,790562,42836,2735,Jun,ktp62UtKy1c
1,"Prince Rupert's Drop EXPLODING in Epoxy Resin at 456,522 fps - Smarter Every Day 273",2022-05-29T14:00:03Z,3307023,119865,8494,May,X3o71W4uNHc
2,Why Jet Boats are AWESOME (U.S. Coast Guard's Workhorse) - Smarter Every Day 272,2022-04-29T14:04:00Z,1727025,68878,3957,Apr,uFzuRm3wCDk
3,How Does Kodak Make Film? (Kodak Factory Tour Part 1 of 3) - Smarter Every Day 271,2022-03-19T14:02:17Z,2546444,77893,5282,Mar,HQKy1KJpSVc
4,Why Are there Holes in the James Webb Sunshield? (Explained by My Dad) - Smarter Every Day 270,2022-03-01T05:28:36Z,2462283,88513,5436,Mar,Pu97IiO_yDI
5,Orphanage built with money raised on YouTube (Update) - Smarter Every Day 269,2022-02-25T18:43:39Z,424609,29629,964,Feb,L9a-yhJO0Mw
6,Why This Zig-Zag Coast Guard Search Pattern is Actually Genius - Smarter Every Day 268,2022-01-18T15:36:30Z,5229352,163894,8182,Jan,aoXJfuPaFF8
7,What does a Gong Sound Like when Hit with a 1189mph Baseball? - Smarter Every Day 267,2021-12-07T15:00:14Z,5552921,199753,16854,Dec,at-xZA5U1ps
8,YouTube is Changing - Smarter Every Day 266,2021-12-01T14:00:24Z,1667396,108896,8641,Dec,ZVaUoyabjAg
9,When you call the US Coast Guard - Smarter Every Day 265,2021-11-16T02:46:19Z,1652034,79488,3448,Nov,fU_pilTk624
10,"1,074 MPH BASEBALL vs. 1 Gallon of Mayonnaise - Smarter Every Day 264",2021-10-28T14:15:08Z,2831215,102912,10072,Oct,pAOCiNhQW2Y
11,Is Your Privacy An Illusion? (Taking on Big Tech) - Smarter Every Day 263,2021-10-21T14:37:16Z,1733733,164088,13001,Oct,KMtrY6lbjcY
12,How Does The James Webb Space Telescope Work? - Smarter Every Day 262,2021-10-01T05:15:01Z,3374893,137788,8350,Oct,4P8fKd0IVOs
13,How Carburetors are Made (Basically Magic) - Holley Factory Tour | Smarter Every Day 261,2021-08-21T04:33:53Z,2248529,86657,6060,Aug,1_hFKRDDP_o
14,How to Surface a Submarine in the Arctic Ocean  - Smarter Every Day 260,2021-07-30T21:26:13Z,4550673,152193,9651,Jul,XFJnWp1tAdU
15,"How Does A Carburetor Work? | Transparent Carburetor at 28,546 fps Slow Mo - Smarter Every Day 259",2021-06-30T16:01:11Z,8429696,370369,26481,Jun,toVfvRhWbj8
16,How Does Film ACTUALLY Work? (It's MAGIC)  [Photos and Development] - Smarter Every Day 258,2021-06-13T21:14:30Z,3230783,126369,9537,Jun,TCxoZlFqzwA
17,"Exploding Weed Seeds (28,546 fps Slow Motion)- Smarter Every Day 257",2021-05-30T14:00:14Z,2956801,146552,9887,May,MUaTOoVmg1Q
18,How to Poop on a Nuclear Submarine - Smarter Every Day 256,2021-05-09T14:00:20Z,2462532,87757,5011,May,SYFuA3xnkUE
19,"What happens when 2 Weedeaters Hit Each Other? (28,000 fps SLOW MOTION)  - Smarter Every Day 255",2021-04-30T01:02:05Z,3523360,140012,12337,Apr,flmkQZvN_g8
20,How Chickens Develop Inside an Egg - Smarter Every Day 254,2021-04-18T13:00:31Z,825168,64905,5174,Apr,zKNlPrEQwPY
21,The Mystery of Magnetic Worms - Smarter Every Day 253,2021-03-31T14:28:27Z,1486285,109250,6640,Mar,Ms65JBrevYU
22,How Does NASA Practice Landing on the Moon? - Smarter Every Day 252,2021-03-07T14:03:29Z,1384711,52915,3966,Mar,aw8kRZEvh_s
23,How Do Nuclear Submarines Make Oxygen?- Smarter Every Day 251,2021-02-21T14:00:10Z,6636292,216871,11982,Feb,g3Ud6mHdhlQ
24,How Neil Armstrong Trained to Land on the Moon  - Smarter Every Day 250,2021-01-30T19:52:44Z,1652524,83002,6120,Jan,_OXk4RKZhaY
25,How Sonar Works (Submarine Shadow Zone) - Smarter Every Day 249,2020-12-26T16:03:40Z,3713341,146111,8167,Dec,AqqaYs7LjlM
26,How to Harvest Pecans (In Slow Motion) - Smarter Every Day 248,2020-12-06T14:00:01Z,3321711,120965,9668,Dec,aK5AnViPkJ0
27,"Trying to Catch a 1,000 MPH Baseball - Smarter Every Day 247",2020-11-12T14:55:58Z,15000454,364104,24964,Nov,4I-p8vjQ95s
28,How to Make Pizza on a Submarine - Smarter Every Day 246,2020-11-01T17:10:34Z,5023276,146155,9483,Nov,bPJUVKizh90
29,Explosive Bat in Slow Motion Ft. Stuff Made Here - Smarter Every Day 245,2020-10-18T13:00:01Z,3287814,123414,6140,Oct,6zHegXvEwdI
30,How to Fight Fire or Flooding on a Nuclear Submarine - Smarter Every Day 244,2020-10-04T13:00:01Z,2739532,85236,4056,Oct,ajK1QMP7ZyI
31,Navy SEAL Astronauts - Smarter Every Day 243,2020-09-27T14:15:23Z,2148580,81121,5084,Sep,QlTf5X0MKbg
32,World's Fastest Pitch - Supersonic Baseball Cannon - Smarter Every Day 242,2020-09-06T15:38:12Z,12888251,418839,25578,Sep,cqidD7kVnxY
33,Crawling Down A Torpedo Tube -US NAVY Nuclear Submarine - Smarter Every Day 241,2020-08-16T13:00:41Z,5265423,163451,8613,Aug,UYEyhB0AGlw
34,Boarding a US NAVY NUCLEAR SUBMARINE in the Arctic - Smarter Every Day 240,2020-07-26T14:57:41Z,10943362,251731,15673,Jul,RXXMJAU6vY8
35,Everything about Sea Turtles  - Smarter Every Day 239,2020-07-13T23:31:09Z,2392018,57656,3890,Jul,5fZRRfai1bs
36,"Which Shape CUTS BEST? (Weed Eater Line at 100,000 Frames Per Second) - Smarter Every Day 238",2020-06-28T15:43:13Z,3154194,122948,14532,Jun,Dy55X4QaAAU
37,How I Boarded a US NAVY NUCLEAR SUBMARINE in the Arctic (ICEX 2020) - Smarter Every Day 237,2020-06-14T15:04:00Z,4090497,153939,9051,Jun,5d6SEQQbwtU
38,"How Weed Eaters Work (at 62,000 FRAMES PER SECOND) - Smarter Every Day 236",2020-05-31T15:34:49Z,7948906,195762,15464,May,S1opkMO1w4U
39,GOING SUPERSONIC with U.S. Air Force Thunderbirds! Pulling 7 G's in an F-16 -Smarter Every Day 235,2020-05-18T21:55:08Z,18021155,392932,15687,May,p1PgNbgWSyY
40,How Birds Do the Thing - Smarter Every Day 234,2020-04-27T13:26:36Z,956806,48523,3737,Apr,4LWmRuB-uNU
41,We Made Face Shields - Smarter Every Day 233,2020-04-07T16:01:32Z,632731,36753,2467,Apr,sbEj7M3aZIg
42,Reddit Disinformation & How We Beat It Together - Smarter Every Day 232,2020-03-25T17:03:58Z,968682,40310,4670,Mar,soYkEqDp760
43,HOW ROCKETS ARE MADE (Rocket Factory Tour - United Launch Alliance) - Smarter Every Day 231,2020-02-29T19:25:15Z,11361087,244547,14921,Feb,o0fG_lnVhHw
44,"World's Longest Home Run (The ""Mad Batter"" Machine) - Smarter Every Day 230",2020-01-01T05:58:06Z,20000053,282215,12289,Jan,Q_F9CxSmGOM
